**State**,**Description**
**CANCELLED (CA)**,Job was explicitly cancelled by the user or system administrator
**COMPLETED (CD)**,Job has terminated all processes on all nodes with an exit code of zero
**PENDING (PD)**,"Job is awaiting resource allocation, there is some different reasons"
**RUNNING (R)**,Job currently has an allocation
**STOPPED (ST)**,"Job has an allocation, but execution has been stopped with SIGSTOP signal. CPUS have been retained by this job"
**SUSPENDED (S)**,"Job has an allocation, but execution has been suspended and CPUs have been released for other jobs"
